{"artifact_id":"artifact:705163c2d401e60115dce5bd457d8e31d77b275ff155205cbefd58a6cf68f7d9","counts":{"cluster":12,"edge":16,"ending":2,"entry":1,"first":11,"node":18,"route":24,"unit":10},"parts":[{"bytes":2700,"kind":"unit","object_id":"8cab6987e0551d981ce033d045304b342e59e5afebc2e4d8a810866371841ef1","ordinal":0,"row_count":10},{"bytes":6878,"kind":"node","object_id":"33c00a75e73477d9c7c5e15f961d7bb605b97b78f67c8b3ea4e2ce61164adec6","ordinal":0,"row_count":18},{"bytes":8751,"kind":"edge","object_id":"457cacddfe7bf0d75e0ab670d7bb2d108d26915cc41f30aa792b885b2ac5513d","ordinal":0,"row_count":16},{"bytes":322,"kind":"entry","object_id":"10870cc2d3b168532a9c2ddae1a49ebba1cc1b8074c15ead4726d61e55e76ea9","ordinal":0,"row_count":1},{"bytes":587,"kind":"ending","object_id":"a1779602185771c0d20ad17e3ead56a8b5e931cc8da023f23e80fa37d2f18672","ordinal":0,"row_count":2},{"bytes":5994,"kind":"route","object_id":"c343ebcbe65387ce6bb64a4fb8e7b784e751bb7210d2146f7ea2f2ccc7f2e8b9","ordinal":0,"row_count":24},{"bytes":3538,"kind":"cluster","object_id":"8bf9a7ba04ad2e98d8c1d3ed719dcae41b06ec5c3063eabce7fe996b2c37ec80","ordinal":0,"row_count":12},{"bytes":3152,"kind":"first","object_id":"940067bb6b8f9a1b6c8c3009f7de1842ae2f3c82bc9beac8209075d1f7e4cfd3","ordinal":0,"row_count":11}],"projection_version":1,"row_count":94}